{
  "$schema": "http://json-schema.org/draft-07/schema#",
  "$id": "https://github.com/threadsafe-systems/pi-sdlc/skills/sdlc-retro/schema/run.schema.json",
  "title": "sdlc-retro-run-record",
  "description": "run.json v1 (spec §7): the distilled post-mortem record produced by collect-run from the FS13 run store. hard values are measured or absent (coverage-marked), never estimated; soft values are model-attributed and structurally separated so the renderer cannot conflate them. This schema is consumed same-version-pinned with the collector that produced the file (both ship in the sdlc-retro bundle); additive optional fields (e.g. panels[].wave, panelPrecision[].wave) therefore do not bump schemaVersion, but a separately-pinned/older copy of this closed schema will reject a newer record's added fields — pin the schema to the producing collector.",
  "type": "object",
  "additionalProperties": false,
  "required": ["schemaVersion", "slug", "coverage", "sizeProxies", "hard"],
  "properties": {
    "schemaVersion": { "type": "integer", "const": 1 },
    "slug": { "type": "string", "pattern": "^[a-z0-9]+(?:-[a-z0-9]+)*$" },
    "title": { "type": "string", "minLength": 1 },
    "track": { "type": "string", "minLength": 1 },
    "coverage": {
      "type": "array",
      "items": {
        "type": "object",
        "additionalProperties": false,
        "required": ["marker"],
        "properties": {
          "marker": { "type": "string", "minLength": 1 },
          "detail": { "type": "string" }
        }
      }
    },
    "sizeProxies": {
      "type": "object",
      "additionalProperties": false,
      "required": ["scenarios", "tasks", "sessions", "phases"],
      "properties": {
        "scenarios": { "$ref": "#/definitions/nonNegInt" },
        "tasks": { "$ref": "#/definitions/nonNegInt" },
        "diff": {
          "type": "object",
          "additionalProperties": false,
          "required": ["files", "insertions", "deletions"],
          "properties": {
            "files": { "$ref": "#/definitions/nonNegInt" },
            "insertions": { "$ref": "#/definitions/nonNegInt" },
            "deletions": { "$ref": "#/definitions/nonNegInt" }
          }
        },
        "sessions": { "$ref": "#/definitions/nonNegInt" },
        "phases": { "type": "array", "items": { "$ref": "#/definitions/lifecyclePhase" } }
      }
    },
    "hard": {
      "type": "object",
      "additionalProperties": false,
      "required": ["window", "phases", "sessions", "panels", "models", "rollups", "rework", "totals"],
      "properties": {
        "window": {
          "type": "object",
          "additionalProperties": false,
          "required": ["start", "end"],
          "properties": {
            "start": { "$ref": "#/definitions/ts" },
            "end": { "$ref": "#/definitions/ts" }
          }
        },
        "phases": {
          "type": "array",
          "items": {
            "type": "object",
            "additionalProperties": false,
            "required": ["phase", "start", "end"],
            "properties": {
              "phase": { "$ref": "#/definitions/lifecyclePhase" },
              "start": { "$ref": "#/definitions/ts" },
              "end": { "$ref": "#/definitions/ts" },
              "exitExplicit": { "type": "boolean" }
            }
          }
        },
        "sessions": {
          "type": "array",
          "items": {
            "type": "object",
            "additionalProperties": false,
            "required": ["file", "start", "end"],
            "properties": {
              "file": { "type": "string", "minLength": 1 },
              "start": { "$ref": "#/definitions/ts" },
              "end": { "$ref": "#/definitions/ts" },
              "models": { "type": "array", "items": { "type": "string", "minLength": 1 } }
            }
          }
        },
        "panels": {
          "type": "array",
          "items": {
            "type": "object",
            "additionalProperties": false,
            "required": ["panelPhase", "round", "dir", "models"],
            "properties": {
              "panelPhase": { "$ref": "#/definitions/panelPhase" },
              "round": { "$ref": "#/definitions/posInt" },
              "wave": { "$ref": "#/definitions/posInt" },
              "dir": { "type": "string", "minLength": 1 },
              "models": {
                "type": "array",
                "items": {
                  "type": "object",
                  "additionalProperties": false,
                  "required": ["model"],
                  "properties": {
                    "model": { "type": "string", "minLength": 1 },
                    "tokens": { "$ref": "#/definitions/nonNegInt" },
                    "cost": { "type": "number", "minimum": 0 },
                    "durationMs": { "$ref": "#/definitions/nonNegInt" },
                    "turns": { "$ref": "#/definitions/nonNegInt" }
                  }
                }
              }
            }
          }
        },
        "models": { "type": "array", "items": { "type": "string", "minLength": 1 } },
        "rollups": {
          "type": "object",
          "additionalProperties": false,
          "required": ["byModel", "byPhase"],
          "properties": {
            "byModel": {
              "type": "array",
              "items": {
                "type": "object",
                "additionalProperties": false,
                "required": ["model", "tokens", "cost"],
                "properties": { "model": { "type": "string", "minLength": 1 }, "tokens": { "$ref": "#/definitions/nonNegInt" }, "cost": { "type": "number", "minimum": 0 } }
              }
            },
            "byPhase": {
              "type": "array",
              "items": {
                "type": "object",
                "additionalProperties": false,
                "required": ["phase", "tokens", "cost"],
                "properties": { "phase": { "$ref": "#/definitions/lifecyclePhase" }, "tokens": { "$ref": "#/definitions/nonNegInt" }, "cost": { "type": "number", "minimum": 0 } }
              }
            }
          }
        },
        "rework": {
          "type": "object",
          "additionalProperties": false,
          "required": ["artifactRevised", "phaseBackward", "fixWave"],
          "properties": {
            "artifactRevised": { "$ref": "#/definitions/nonNegInt" },
            "phaseBackward": { "$ref": "#/definitions/nonNegInt" },
            "fixWave": { "$ref": "#/definitions/nonNegInt" }
          }
        },
        "totals": {
          "type": "object",
          "additionalProperties": false,
          "required": ["tokens", "cost", "wallMs", "agentMs", "humanWaitMs"],
          "properties": {
            "tokens": { "$ref": "#/definitions/nonNegInt" },
            "cost": { "type": "number", "minimum": 0 },
            "wallMs": { "$ref": "#/definitions/nonNegInt" },
            "agentMs": { "$ref": "#/definitions/nonNegInt" },
            "humanWaitMs": { "$ref": "#/definitions/nonNegInt" }
          }
        }
      }
    },
    "soft": {
      "type": "object",
      "additionalProperties": false,
      "required": ["attribution", "narratives", "steering", "panelPrecision"],
      "properties": {
        "attribution": {
          "type": "object",
          "additionalProperties": false,
          "required": ["model", "provider"],
          "properties": { "model": { "type": "string", "minLength": 1 }, "provider": { "type": "string", "minLength": 1 } }
        },
        "narratives": {
          "type": "array",
          "items": {
            "type": "object",
            "additionalProperties": false,
            "required": ["phase", "summary"],
            "properties": { "phase": { "$ref": "#/definitions/lifecyclePhase" }, "summary": { "type": "string", "maxLength": 500 } }
          }
        },
        "steering": {
          "type": "array",
          "items": {
            "type": "object",
            "additionalProperties": false,
            "required": ["index", "ts", "class"],
            "properties": {
              "index": { "$ref": "#/definitions/nonNegInt" },
              "ts": { "$ref": "#/definitions/ts" },
              "class": { "type": "string", "enum": ["gate-approval", "correction", "scope-change", "unblock", "other"] }
            }
          }
        },
        "panelPrecision": {
          "type": "array",
          "items": {
            "type": "object",
            "additionalProperties": false,
            "required": ["panelPhase", "round", "model", "raised", "incorporated", "dismissed"],
            "properties": {
              "panelPhase": { "$ref": "#/definitions/panelPhase" },
              "round": { "$ref": "#/definitions/posInt" },
              "wave": { "$ref": "#/definitions/posInt" },
              "model": { "type": "string", "minLength": 1 },
              "raised": { "$ref": "#/definitions/nonNegInt" },
              "incorporated": { "$ref": "#/definitions/nonNegInt" },
              "dismissed": { "$ref": "#/definitions/nonNegInt" }
            }
          }
        }
      }
    }
  },
  "definitions": {
    "lifecyclePhase": { "type": "string", "enum": ["brainstorm", "plan", "spec", "build", "implement", "pr"] },
    "panelPhase": { "type": "string", "enum": ["plan_review", "spec_review", "pr_review", "task_validate"] },
    "ts": { "type": "string", "pattern": "^\\d{4}-\\d{2}-\\d{2}T\\d{2}:\\d{2}:\\d{2}(?:\\.\\d+)?Z$" },
    "posInt": { "type": "integer", "minimum": 1 },
    "nonNegInt": { "type": "integer", "minimum": 0 }
  }
}
